### ISSUE TITLE
[Bug]: CN connection hang, `select @@version_comment` wait for response infinitely

### ISSUE THREAD

**Issue by aylei** [matrixorigin/matrixone#11590]
### Is there an existing issue for the same bug?

- [X] I have checked the existing issues.

### Environment

```Markdown
- Version or commit-id (e.g. v0.1.0 or 8b23a93): https://github.com/matrixorigin/matrixone/commit/667f74e100c37fd69228a4f2cd89867369d964cd
- Hardware parameters:
- OS type:
- Others:
```

### Actual Behavior

CN connection hang

tcpdump, client waits for `select @@version_comment limit 1` result infinitely.

```
No.	Time	Source	Src Port	Destination	Dst Port	Protocol	Length	Info	DateTime
1	0.000000	127.0.0.1	61082	127.0.0.1	6001	MySQL	61	Request Quit	2023-09-01 09:52:04.533244
2	0.000041	127.0.0.1	6001	127.0.0.1	61082	TCP	56	6001 → 61082 [ACK] Seq=1 Ack=6 Win=6375 Len=0 TSval=3203808539 TSecr=1616514016	2023-09-01 09:52:04.533285
3	0.000058	127.0.0.1	61082	127.0.0.1	6001	TCP	56	61082 → 6001 [FIN, ACK] Seq=6 Ack=1 Win=6377 Len=0 TSval=1616514016 TSecr=3203808539	2023-09-01 09:52:04.533302
4	0.000085	127.0.0.1	6001	127.0.0.1	61082	TCP	56	6001 → 61082 [ACK] Seq=1 Ack=7 Win=6375 Len=0 TSval=3203808539 TSecr=1616514016	2023-09-01 09:52:04.533329
5	1.044685	127.0.0.1	6001	127.0.0.1	61082	TCP	56	6001 → 61082 [FIN, ACK] Seq=1 Ack=7 Win=6375 Len=0 TSval=3203809583 TSecr=1616514016	2023-09-01 09:52:05.577929
6	1.044758	127.0.0.1	61082	127.0.0.1	6001	TCP	56	61082 → 6001 [ACK] Seq=7 Ack=2 Win=6377 Len=0 TSval=1616515060 TSecr=3203809583	2023-09-01 09:52:05.578002
7	3.075614	127.0.0.1	61170	127.0.0.1	6001	TCP	68	61170 → 6001 [SYN] Seq=0 Win=65535 Len=0 MSS=16344 WS=64 TSval=864408953 TSecr=0 SACK_PERM	2023-09-01 09:52:07.608858
8	3.075682	127.0.0.1	6001	127.0.0.1	61170	TCP	68	6001 → 61170 [SYN, ACK] Seq=0 Ack=1 Win=65535 Len=0 MSS=16344 WS=64 TSval=708146428 TSecr=864408953 SACK_PERM	2023-09-01 09:52:07.608926
9	3.075690	127.0.0.1	61170	127.0.0.1	6001	TCP	56	61170 → 6001 [ACK] Seq=1 Ack=1 Win=408256 Len=0 TSval=864408953 TSecr=708146428	2023-09-01 09:52:07.608934
10	3.075696	127.0.0.1	6001	127.0.0.1	61170	TCP	56	[TCP Window Update] 6001 → 61170 [ACK] Seq=1 Ack=1 Win=408256 Len=0 TSval=708146428 TSecr=864408953	2023-09-01 09:52:07.608940
11	3.315389	127.0.0.1	6001	127.0.0.1	61170	MySQL	155	Server Greeting  proto=10 version=8.0.30-MatrixOne-v1.0.0-rc1 	2023-09-01 09:52:07.848633
12	3.315410	127.0.0.1	61170	127.0.0.1	6001	TCP	56	61170 → 6001 [ACK] Seq=1 Ack=100 Win=408192 Len=0 TSval=864409193 TSecr=708146668	2023-09-01 09:52:07.848654
13	3.316216	127.0.0.1	61170	127.0.0.1	6001	MySQL	260	Login Request user=dump 	2023-09-01 09:52:07.849460
14	3.316231	127.0.0.1	6001	127.0.0.1	61170	TCP	56	6001 → 61170 [ACK] Seq=100 Ack=205 Win=408064 Len=0 TSval=708146668 TSecr=864409193	2023-09-01 09:52:07.849475
15	3.335868	127.0.0.1	6001	127.0.0.1	61170	MySQL	68	Response  OK 	2023-09-01 09:52:07.869112
16	3.335896	127.0.0.1	61170	127.0.0.1	6001	TCP	56	61170 → 6001 [ACK] Seq=205 Ack=112 Win=408128 Len=0 TSval=864409214 TSecr=708146689	2023-09-01 09:52:07.869140
17	3.336132	127.0.0.1	61170	127.0.0.1	6001	MySQL	93	Request Query	2023-09-01 09:52:07.869376
18	3.336149	127.0.0.1	6001	127.0.0.1	61170	TCP	56	6001 → 61170 [ACK] Seq=112 Ack=242 Win=408000 Len=0 TSval=708146689 TSecr=864409214	2023-09-01 09:52:07.869393
19	18.429831	127.0.0.1	6001	127.0.0.1	61170	TCP	44	[TCP Keep-Alive] 6001 → 61170 [ACK] Seq=111 Ack=242 Win=408000 Len=0	2023-09-01 09:52:22.963075
20	18.429915	127.0.0.1	61170	127.0.0.1	6001	TCP	56	[TCP Keep-Alive ACK] 61170 → 6001 [ACK] Seq=242 Ack=112 Win=408128 Len=0 TSval=864424308 TSecr=708146689	2023-09-01 09:52:22.963159
21	33.523145	127.0.0.1	6001	127.0.0.1	61170	TCP	44	[TCP Keep-Alive] 6001 → 61170 [ACK] Seq=111 Ack=242 Win=408000 Len=0	2023-09-01 09:52:38.056389
22	33.523207	127.0.0.1	61170	127.0.0.1	6001	TCP	56	[TCP Keep-Alive ACK] 61170 → 6001 [ACK] Seq=242 Ack=112 Win=408128 Len=0 TSval=864439401 TSecr=708146689	2023-09-01 09:52:38.056451
23	48.564174	127.0.0.1	6001	127.0.0.1	61170	TCP	44	[TCP Keep-Alive] 6001 → 61170 [ACK] Seq=111 Ack=242 Win=408000 Len=0	2023-09-01 09:52:53.097418
24	48.564208	127.0.0.1	61170	127.0.0.1	6001	TCP	56	[TCP Keep-Alive ACK] 61170 → 6001 [ACK] Seq=242 Ack=112 Win=408128 Len=0 TSval=864454442 TSecr=708146689	2023-09-01 09:52:53.097452
```

Trace:

```


runtime.selectgo:327
--
github.com/matrixorigin/matrixone/pkg/txn/client.(*waiter).wait:180
github.com/matrixorigin/matrixone/pkg/txn/client.(*txnOperator).waitActive:228
github.com/matrixorigin/matrixone/pkg/txn/client.(*txnClient).New:245
github.com/matrixorigin/matrixone/pkg/frontend.(*TxnHandler).NewTxnOperator:152
github.com/matrixorigin/matrixone/pkg/frontend.(*TxnHandler).NewTxn:215
github.com/matrixorigin/matrixone/pkg/frontend.(*Session).TxnCreate:542
github.com/matrixorigin/matrixone/pkg/frontend.(*TxnHandler).GetTxn:401
github.com/matrixorigin/matrixone/pkg/frontend.(*TxnComputationWrapper).Compile:209
github.com/matrixorigin/matrixone/pkg/frontend.(*MysqlCmdExecutor).executeStmt:3126
github.com/matrixorigin/matrixone/pkg/frontend.(*MysqlCmdExecutor).doComQuery:3584
github.com/matrixorigin/matrixone/pkg/frontend.(*MysqlCmdExecutor).ExecRequest:3735
github.com/matrixorigin/matrixone/pkg/frontend.(*Routine).handleRequest:218
github.com/matrixorigin/matrixone/pkg/frontend.(*RoutineManager).Handler:482
github.com/fagongzi/goetty/v2.(*server).doConnection:381
github.com/fagongzi/goetty/v2.(*server).doStart.func2.1:344
```

Query hangs on `waiter.wait`

### Additional information

Restart CN will address this problem shortly, but will be reproduced after running a while.

**Comment by daviszhen** [comment]
跟这个问题一摸一样。https://github.com/matrixorigin/matrixone/issues/11551#issuecomment-1698456133

**Comment by aylei** [comment]
> 跟这个问题一摸一样。[#11551 (comment)](https://github.com/matrixorigin/matrixone/issues/11551#issuecomment-1698456133)

多谢，我升级到新的 fix 上验证一下

**Comment by aylei** [comment]
duplicated with #11551
