### ISSUE TITLE
[Bug]: CN hang on new connection (select version command)

### ISSUE THREAD

**Issue by aylei** [matrixorigin/matrixone#11839]
### Is there an existing issue for the same bug?

- [X] I have checked the existing issues.

### Environment

```Markdown
- Version or commit-id (e.g. v0.1.0 or 8b23a93): 16d88550
- Hardware parameters:
- OS type:
- Others:
```

### Actual Behavior

CN hangs on new connection

Packets:

```
No.	Time	Source	Src Port	Destination	Dst Port	Protocol	Length	Info	DateTime
1	0.000000	127.0.0.1	6001	127.0.0.1	54282	TCP	44	6001 → 54282 [ACK] Seq=1 Ack=1 Win=6375 Len=0	2023-09-19 17:45:02.800222
2	0.000054	127.0.0.1	54282	127.0.0.1	6001	TCP	56	[TCP ACKed unseen segment] 54282 → 6001 [ACK] Seq=1 Ack=2 Win=6377 Len=0 TSval=2060997694 TSecr=1329374230	2023-09-19 17:45:02.800276
3	1.528678	127.0.0.1	6001	127.0.0.1	54716	TCP	44	6001 → 54716 [ACK] Seq=1 Ack=1 Win=6375 Len=0	2023-09-19 17:45:04.328900
4	1.528720	127.0.0.1	54716	127.0.0.1	6001	TCP	56	[TCP ACKed unseen segment] 54716 → 6001 [ACK] Seq=1 Ack=2 Win=6377 Len=0 TSval=2729192344 TSecr=3325209307	2023-09-19 17:45:04.328942
5	4.887883	127.0.0.1	54969	127.0.0.1	6001	TCP	68	54969 → 6001 [SYN] Seq=0 Win=65535 Len=0 MSS=16344 WS=64 TSval=3712827168 TSecr=0 SACK_PERM	2023-09-19 17:45:07.688105
6	4.887929	127.0.0.1	6001	127.0.0.1	54969	TCP	68	6001 → 54969 [SYN, ACK] Seq=0 Ack=1 Win=65535 Len=0 MSS=16344 WS=64 TSval=52561730 TSecr=3712827168 SACK_PERM	2023-09-19 17:45:07.688151
7	4.887937	127.0.0.1	54969	127.0.0.1	6001	TCP	56	54969 → 6001 [ACK] Seq=1 Ack=1 Win=408256 Len=0 TSval=3712827168 TSecr=52561730	2023-09-19 17:45:07.688159
8	4.887942	127.0.0.1	6001	127.0.0.1	54969	TCP	56	[TCP Window Update] 6001 → 54969 [ACK] Seq=1 Ack=1 Win=408256 Len=0 TSval=52561730 TSecr=3712827168	2023-09-19 17:45:07.688164
9	5.121530	127.0.0.1	6001	127.0.0.1	54969	MySQL	155	Server Greeting  proto=10 version=8.0.30-MatrixOne-v1.0.0-rc1 	2023-09-19 17:45:07.921752
10	5.121568	127.0.0.1	54969	127.0.0.1	6001	TCP	56	54969 → 6001 [ACK] Seq=1 Ack=100 Win=408192 Len=0 TSval=3712827402 TSecr=52561964	2023-09-19 17:45:07.921790
11	5.123204	127.0.0.1	54969	127.0.0.1	6001	MySQL	311	Login Request user=17dcdd65_3f06_4671_90dd_1bf8fa14327d:admin:accountadmin 	2023-09-19 17:45:07.923426
12	5.123234	127.0.0.1	6001	127.0.0.1	54969	TCP	56	6001 → 54969 [ACK] Seq=100 Ack=256 Win=408000 Len=0 TSval=52561966 TSecr=3712827404	2023-09-19 17:45:07.923456
13	5.138922	127.0.0.1	6001	127.0.0.1	54969	MySQL	68	Response  OK 	2023-09-19 17:45:07.939144
14	5.138951	127.0.0.1	54969	127.0.0.1	6001	TCP	56	54969 → 6001 [ACK] Seq=256 Ack=112 Win=408128 Len=0 TSval=3712827419 TSecr=52561981	2023-09-19 17:45:07.939173
15	5.139169	127.0.0.1	54969	127.0.0.1	6001	MySQL	93	Request Query	2023-09-19 17:45:07.939391
16	5.139195	127.0.0.1	6001	127.0.0.1	54969	TCP	56	6001 → 54969 [ACK] Seq=112 Ack=293 Win=408000 Len=0 TSval=52561981 TSecr=3712827419	2023-09-19 17:45:07.939417
```

Suspicious stack:

```
runtime.selectgo:327
github.com/matrixorigin/matrixone/pkg/txn/client.(*waiter).wait:180
github.com/matrixorigin/matrixone/pkg/txn/client.(*txnOperator).waitActive:228
github.com/matrixorigin/matrixone/pkg/txn/client.(*txnClient).New:245
github.com/matrixorigin/matrixone/pkg/frontend.(*TxnHandler).NewTxnOperator:152
github.com/matrixorigin/matrixone/pkg/frontend.(*TxnHandler).NewTxn:215
github.com/matrixorigin/matrixone/pkg/frontend.(*Session).TxnCreate:545
github.com/matrixorigin/matrixone/pkg/frontend.(*TxnHandler).GetTxn:404
github.com/matrixorigin/matrixone/pkg/frontend.(*TxnComputationWrapper).Compile:209
github.com/matrixorigin/matrixone/pkg/frontend.(*MysqlCmdExecutor).executeStmt:3147
github.com/matrixorigin/matrixone/pkg/frontend.(*MysqlCmdExecutor).doComQuery:3605
github.com/matrixorigin/matrixone/pkg/frontend.(*MysqlCmdExecutor).ExecRequest:3756
github.com/matrixorigin/matrixone/pkg/frontend.(*Routine).handleRequest:218
github.com/matrixorigin/matrixone/pkg/frontend.(*RoutineManager).Handler:482
github.com/fagongzi/goetty/v2.(*server).doConnection:381
github.com/fagongzi/goetty/v2.(*server).doStart.func2.1:344
```

Trace file: [trace.log](https://github.com/matrixorigin/matrixone/files/12659576/trace.log)
CN log: [cn-hang.txt](https://github.com/matrixorigin/matrixone/files/12659579/cn-hang.txt)

### Expected Behavior

CN should not hang

**Comment by aylei** [comment]
Note: this cluster has https://github.com/matrixorigin/matrixone/issues/11823 issue, which causes CNs crash randomly

**Comment by aylei** [comment]
similar issue: https://github.com/matrixorigin/matrixone/issues/11838

please check whether this issue is duplicated

**Comment by zhangxu19830126** [comment]
dup with #11838
