### ISSUE TITLE
[Bug]: CN new connection hang

### ISSUE THREAD

**Issue by aylei** [matrixorigin/matrixone#11142]
### Is there an existing issue for the same bug?

- [X] I have checked the existing issues.

### Environment

```Markdown
- Version or commit-id (e.g. v0.1.0 or 8b23a93): eb846e3e
- Hardware parameters:
- OS type:
- Others:
```

### Actual Behavior

CN connection hang:

```
mysql -h 127.0.0.1 -P6001 -u root -puws4gP1eAOmh
[proxychains] config file found: /usr/local/etc/proxychains.conf
[proxychains] preloading /usr/local/Cellar/proxychains-ng/4.16/lib/libproxychains4.dylib
mysql: [Warning] Using a password on the command line interface can be insecure.
^C
```

```
kg po -n freetier-01
NAME                             READY   STATUS    RESTARTS      AGE
default-cn-jgpbx                 1/1     Running   0             146m
default-cn-wwwsc                 1/1     Running   0             136m
```

new connection will hang when connected to `default-cn-jgpbx`, `default-cn-wwwsc` is normal.

Also, since `default-cn-jgpbx` is abnormal and the session count is likely lower than `default-cn-wwwsc`, proxy will always route new sessions to `default-cn-jgpbx`, which cause the whole cluster unavailable.

### Expected Behavior

CN should handle new connection smmothly.

Also, unhealthy CN should be marked as unavailable and proxy should not route sessions to unavailable CNs;

### Additional information

- CN log: [cn-log.txt](https://github.com/matrixorigin/matrixone/files/12309442/cn-log.txt)
- CN profile: [cn-profile.log](https://github.com/matrixorigin/matrixone/files/12309451/cn-profile.log)
- CN goroutine dump: [goroutine.txt](https://github.com/matrixorigin/matrixone/files/12309455/goroutine.txt)
- Proxy log: [proxy-log.tgz](https://github.com/matrixorigin/matrixone/files/12309506/proxy-log.tgz)

Note: the CN connection hangs even we don't use proxy.

**Comment by aylei** [comment]
reproduced in low connection case:

```
kg po -n freetier-01
NAME                             READY   STATUS    RESTARTS      AGE
default-cn-jgpbx                 1/1     Running   0             146m
default-cn-wwwsc                 1/1     Running   0             136m
```

`default-cn-jgpbx` hangs, `default-cn-wwwsc` is normal.

I suspect since the session count of `default-cn-jgpbx` (cannot be connected) is lower than `default-cn-wwwsc`, proxy will always choose `default-cn-jgpbx` so the whole cluster is unavalable.

**Comment by daviszhen** [comment]
default-cn-jgpbx 被删掉了。还没查出来问题。等复现吧

**Comment by fengttt** [comment]
connection issue?

**Comment by daviszhen** [comment]
> connection issue?

不确定。现在在等复现。之前出问题的cn 被缩容删掉了。

**Comment by daviszhen** [comment]
经过分析卡住时的Profile。
[trace.log](https://github.com/matrixorigin/matrixone/files/12310855/trace.log)

发现 卡住的位置。

![image](https://github.com/matrixorigin/matrixone/assets/60595215/f8db2014-9bfa-4546-825e-94fd46d3868c)

![image](https://github.com/matrixorigin/matrixone/assets/60595215/d20b3f5d-23d4-45b3-b25e-74702c6e4b85)

**Comment by daviszhen** [comment]
cn的日志。
[Uploading cn.tar.gz…]()

从日志中看，事务卡住。
```

➜  Downloads grep ce3d75dd68574d1fbced52b0f0e65eb3 cn.log 
{"level":"DEBUG","time":"2023/08/10 08:38:38.331976 +0000","name":"cn-service.txn","caller":"client/operator.go:188","msg":"txn created","uuid":"66353561-6263-3162-3165-363136386334","txn":"ce3d75dd68574d1fbced52b0f0e65eb3/Active/S:1691656718329410971-1"}
{"level":"DEBUG","time":"2023/08/10 08:38:38.331992 +0000","caller":"disttae/util.go:640","msg":"Engine.New ce3d75dd68574d1fbced52b0f0e65eb3/Active/S:1691656718329410971-1"}
{"level":"DEBUG","time":"2023/08/10 08:38:38.332030 +0000","caller":"disttae/util.go:640","msg":"Engine.Database mo_catalog ce3d75dd68574d1fbced52b0f0e65eb3/Active/S:1691656718329410971-1"}
{"level":"DEBUG","time":"2023/08/10 08:38:38.332042 +0000","caller":"disttae/util.go:640","msg":"txnDatabase.Relation table mo_account ce3d75dd68574d1fbced52b0f0e65eb3/Active/S:1691656718329410971-1"}
{"level":"DEBUG","time":"2023/08/10 08:38:38.332218 +0000","caller":"disttae/util.go:640","msg":"Engine.Database mo_catalog ce3d75dd68574d1fbced52b0f0e65eb3/Active/S:1691656718329410971-1"}
{"level":"DEBUG","time":"2023/08/10 08:38:38.332233 +0000","caller":"disttae/util.go:640","msg":"txnDatabase.Relation table mo_account ce3d75dd68574d1fbced52b0f0e65eb3/Active/S:1691656718329410971-1"}
➜  Downloads 

```

**Comment by volgariver6** [comment]
@LeftHandCold please help on this.

**Comment by LeftHandCold** [comment]
focus #10212

**Comment by LeftHandCold** [comment]
focus https://github.com/matrixorigin/matrixone/issues/10212

**Comment by LeftHandCold** [comment]
focus https://github.com/matrixorigin/matrixone/issues/10212

**Comment by XuPeng-SH** [comment]
assign to @gouhongshen

**Comment by aylei** [comment]
> PR #11196 已经合并，它将 `prefetch queue` 改成了 nonblocking queue，应该能解决阻塞的问题。
> 
> eks 上暂时未能复现，持续观察。

跑过 tpch 了吗？

**Comment by gouhongshen** [comment]
跑的 tpch 10g，不过脚本一直报错，最后单独命令执行的，不知道有没有影响。

**Comment by sukki37** [comment]
> > PR #11196 已经合并，它将 `prefetch queue` 改成了 nonblocking queue，应该能解决阻塞的问题。
> > eks 上暂时未能复现，持续观察。
> 
> 跑过 tpch 了吗？

pr merge之后会自动跑tpch10，https://github.com/matrixorigin/matrixone/actions/runs/5854453845

**Comment by aylei** [comment]
因为兼容性问题还没验证

**Comment by aylei** [comment]
兼容性问题解决了，等升级后验证

**Comment by aylei** [comment]
重新安装了，等待验证一下

**Comment by aylei** [comment]
did not reproduce after running q1-q21 of tpch 10g on aliyun, closing

**Comment by aylei** [comment]
reproduced in commit 47684bd2

**Comment by aylei** [comment]
```
No.	Time	Source	Src Port	Destination	Dst Port	Protocol	Length	Info	DateTime
1	0.000000	127.0.0.1	60087	127.0.0.1	6001	TCP	68	60087 → 6001 [SYN] Seq=0 Win=65535 Len=0 MSS=16344 WS=64 TSval=410169918 TSecr=0 SACK_PERM	2023-08-23 14:19:11.125862
2	0.000042	127.0.0.1	6001	127.0.0.1	60087	TCP	68	6001 → 60087 [SYN, ACK] Seq=0 Ack=1 Win=65535 Len=0 MSS=16344 WS=64 TSval=1304741138 TSecr=410169918 SACK_PERM	2023-08-23 14:19:11.125904
3	0.000048	127.0.0.1	60087	127.0.0.1	6001	TCP	56	60087 → 6001 [ACK] Seq=1 Ack=1 Win=408256 Len=0 TSval=410169918 TSecr=1304741138	2023-08-23 14:19:11.125910
4	0.000053	127.0.0.1	6001	127.0.0.1	60087	TCP	56	[TCP Window Update] 6001 → 60087 [ACK] Seq=1 Ack=1 Win=408256 Len=0 TSval=1304741138 TSecr=410169918	2023-08-23 14:19:11.125915
5	0.235684	127.0.0.1	6001	127.0.0.1	60087	MySQL	151	Server Greeting  proto=10 version=8.0.30-MatrixOne-v0.8.0 	2023-08-23 14:19:11.361546
6	0.235697	127.0.0.1	60087	127.0.0.1	6001	TCP	56	60087 → 6001 [ACK] Seq=1 Ack=96 Win=408192 Len=0 TSval=410170154 TSecr=1304741374	2023-08-23 14:19:11.361559
7	0.236447	127.0.0.1	60087	127.0.0.1	6001	MySQL	260	Login Request user=dump 	2023-08-23 14:19:11.362309
8	0.236455	127.0.0.1	6001	127.0.0.1	60087	TCP	56	6001 → 60087 [ACK] Seq=96 Ack=205 Win=408064 Len=0 TSval=1304741374 TSecr=410170154	2023-08-23 14:19:11.362317
9	0.254784	127.0.0.1	6001	127.0.0.1	60087	MySQL	68	Response  OK 	2023-08-23 14:19:11.380646
10	0.254797	127.0.0.1	60087	127.0.0.1	6001	TCP	56	60087 → 6001 [ACK] Seq=205 Ack=108 Win=408192 Len=0 TSval=410170173 TSecr=1304741393	2023-08-23 14:19:11.380659
11	0.254937	127.0.0.1	60087	127.0.0.1	6001	MySQL	93	Request Query	2023-08-23 14:19:11.380799
12	0.254951	127.0.0.1	6001	127.0.0.1	60087	TCP	56	6001 → 60087 [ACK] Seq=108 Ack=242 Win=408000 Len=0 TSval=1304741393 TSecr=410170173	2023-08-23 14:19:11.380813
13	0.271638	127.0.0.1	6001	127.0.0.1	60087	MySQL	61	Response TABULAR 	2023-08-23 14:19:11.397500
14	0.271646	127.0.0.1	6001	127.0.0.1	60087	MySQL	116	Response 	2023-08-23 14:19:11.397508
15	0.271648	127.0.0.1	60087	127.0.0.1	6001	TCP	56	60087 → 6001 [ACK] Seq=242 Ack=113 Win=408128 Len=0 TSval=410170190 TSecr=1304741410	2023-08-23 14:19:11.397510
16	0.271653	127.0.0.1	60087	127.0.0.1	6001	TCP	56	60087 → 6001 [ACK] Seq=242 Ack=173 Win=408128 Len=0 TSval=410170190 TSecr=1304741410	2023-08-23 14:19:11.397515
17	15.273169	127.0.0.1	6001	127.0.0.1	60087	TCP	44	[TCP Keep-Alive] 6001 → 60087 [ACK] Seq=172 Ack=242 Win=408000 Len=0	2023-08-23 14:19:26.399031
18	15.273200	127.0.0.1	60087	127.0.0.1	6001	TCP	56	[TCP Keep-Alive ACK] 60087 → 6001 [ACK] Seq=242 Ack=173 Win=408128 Len=0 TSval=410185191 TSecr=1304741410	2023-08-23 14:19:26.399062
```

mysql-client hung after receive the result of `select @@version_comment limit 1`, the result seems weird:

```
MySQL Protocol - field packet
    Packet Length: 56
    Packet Number: 2
    Catalog
    Database
    Table
    Original table
    Name
    Original name
    Charset number: utf8 COLLATE utf8_general_ci (33)
    Length: 0
    Type: FIELD_TYPE_BLOB (252)
    Flags: 0x0000
    Decimals: 0
    [Expert Info (Error/Malformed): Invalid length: 1]

```

**Comment by aylei** [comment]
```
{"level":"INFO","time":"2023/08/23 04:40:04.258930 +0000","caller":"frontend/util.go:520","msg":"{account sys:dump:moadmin -- 0:1:0}","session_info":"connectionId 4769429|172.20.33.18:47138|{account sys:dump: -- 0:0:0}|goRoutineId 56293|20aeae2d-416f-11ee-b623-82e968476fe7","session_id":" \ufffd\ufffd-Ao\u0011\ufffd\ufffd#\ufffd\ufffdhGo\ufffd"}
{"level":"WARN","time":"2023/08/23 04:40:04.260749 +0000","caller":"objectio/writer.go:183","msg":"object io: no block needs to be written"}
```

**Comment by aylei** [comment]
another issue, closing, tracked in
